{
  "schema": 1,
  "id": "model-retry-policy",
  "name": "Model Retry Policy",
  "version": "0.2.1",
  "description": "Chooses what KiroCrew does when the model or its API fails transiently (throttling, overload, 5xx, dropped stream) instead of the fixed three retries: a retry count of your own, retry forever at a fixed interval, retry forever with exponential backoff, or a fallback profile that moves to other models after N retries (and optionally never gives up on the last). Applies to dashboard chats (including errors that land mid-turn, after text or a tool call has streamed), cron/Slack turns and sub-agents. Opt-in backend failover: when a dashboard chat's same-model retries are spent, the chat is moved to another agent backend that serves the SAME model (kiro-cli, KAS, Claude Code, Codex \u2014 as Agent Backend Router's served lists allow and Agent Backend Doctor confirms the backend is usable), the conversation replayed by KiroCrew's own provider-switch replay; the model never changes. Unofficial.",
  "authors": [
    "Oscar Tseng"
  ],
  "license": "Apache-2.0",
  "tags": [
    "retry",
    "backoff",
    "fallback",
    "throttling",
    "models",
    "backend-failover"
  ],
  "kirocrew": {
    "version": ">=0.7.0 <0.11.0",
    "editions": [
      "internal",
      "external"
    ],
    "strict": false
  },
  "dependsOn": {
    "floofycrew": "^1.0",
    "agent-backend-doctor": {
      "range": ">=0.2.1 <1.0.0",
      "reason": "answers whether a failover target is usable right now (installed, its cached 'not found' cleared, a Bedrock-backed Codex's credential chain intact) before a throttled chat is moved there"
    }
  },
  "recommends": {
    "agent-backend-router": {
      "range": ">=0.3.2",
      "reason": "the backend failover needs the router's served-list rule and route requests; without it the mechanism stays off and the page says so"
    }
  },
  "network": {
    "hosts": [],
    "credentials": false
  },
  "parts": [
    {
      "kind": "python-hook",
      "side": "gateway",
      "path": "hook/",
      "module": "hook",
      "early": false
    },
    {
      "kind": "ui",
      "side": "spa",
      "path": "ui/",
      "entry": "ui/page.mjs",
      "title": "Model Retry Policy",
      "icon": "ui/icon.svg"
    }
  ],
  "files": [
    {
      "path": "LICENSE",
      "sha256": "efbb38757df87b37a0ba908725830a90cded07b9842ce24e1635bb0763fa2a34"
    },
    {
      "path": "README.md",
      "sha256": "9f065c7ed2f3ad93ac823aaa0a9e40913499b435d31a91e46fd4e2361100a245"
    },
    {
      "path": "hook/__init__.py",
      "sha256": "1a07a817ed43d1c4b96c2fe622cf423989c672e24b794f8d12d98eac8cedcb5d"
    },
    {
      "path": "hook/policy.py",
      "sha256": "a9af25646c958a171ffbaaa61976bb767f84581bc475ebaa0e31b8f9c59a4b14"
    },
    {
      "path": "tests/hook_test.py",
      "sha256": "25bd2b053f057165de938ffb9fe55dd6e7bf484dc82c7b3a32294e79c2755ee1"
    },
    {
      "path": "tests/page_merge_test.py",
      "sha256": "03ed1c1d3ca08e5dfc5a8874862d81c8db6c8fd8bed0b6de5e2970a364fe1a35"
    },
    {
      "path": "tests/page_probe.py",
      "sha256": "e7dc5b3571459c57b4b5340ca8077bda3fd0da7ceaf9f6d5dd34352945af9cd2"
    },
    {
      "path": "tests/policy_test.py",
      "sha256": "f66b83c7344d882954293b4039a7fb03e333a0fd2528a111b09958d9dd605969"
    },
    {
      "path": "tests/smoke_test.py",
      "sha256": "c1faeadfa338932d5bc491152b906c1118201d9d82db82872f51fb3bc73eedef"
    },
    {
      "path": "ui/icon.svg",
      "sha256": "cab17b55ebbdbf3536e17aa2bf210e24c2232f13240d755ca44b7f9398b4c3aa"
    },
    {
      "path": "ui/page.mjs",
      "sha256": "b2e67f768a4a7752b195d3d8411f07503cfb3557d72fc611c04cbac5275b9460"
    }
  ]
}
