{
  "schema": 1,
  "id": "example-ui",
  "name": "Example settings page",
  "version": "1.0.0",
  "description": "A mod with its own page inside the FloofyCrew App (Requirement 16.4): an ES module the App mounts same-origin with floofy.mod(id) — config get/set persisted in the mod's .floofy/config.json. Inert until opened, so it lands enabled.",
  "authors": ["FloofyCrew examples"],
  "license": "Apache-2.0",
  "tags": ["example", "ui"],
  "kirocrew": { "version": ">=0.7.0 <0.9.0", "editions": ["internal", "external"] },
  "dependsOn": { "floofycrew": "^1.1" },
  "network": { "hosts": [], "credentials": false },
  "parts": [
    { "kind": "ui", "side": "spa", "path": "ui/", "entry": "ui/page.mjs", "title": "Example settings" }
  ],
  "files": [
    { "path": "ui/page.mjs", "sha256": "0a7732359c3d00bb03d17d62173766db4bc59d000d20822faa1adca02c0a22e5" }
  ]
}
