{
  "schema": 1,
  "id": "agent-backend-doctor",
  "name": "Agent Backend Doctor",
  "version": "0.2.2",
  "description": "Finds, un-caches and repairs KiroCrew's agent-backend harnesses (Claude Code, Codex, OpenCode, pi). Fills the host's adapter search when an npm global prefix it does not look in (~/.local/node, ~/.npm-global, a ~/.npmrc prefix, $NPM_CONFIG_PREFIX) holds claude-agent-acp / codex-acp / pi-acp; resets the gateway's cached 'not found' so a backend installed after the gateway started works without a restart; keeps a Bedrock-backed Codex's AWS credentials usable inside KiroCrew's sandbox (an isolated 0600 copy of the configured profile's non-secret keys outside ~/.aws, handed to the codex-acp child explicitly, with a launch preflight and a sandboxed provider-chain probe); one page showing per backend what the host sees, what this mod found, the gateway cache state and the advertised models, with an opt-in CODEX_PATH switch (run the codex you installed) and an opt-in symlink repair into ~/.local/bin. Exposes a readiness read for other mods (installed, cache state, Codex preflight) so a session is only moved to a backend that will start. Unofficial.",
  "authors": [
    "Oscar Tseng"
  ],
  "license": "Apache-2.0",
  "tags": [
    "backend",
    "claude-code",
    "codex",
    "npm",
    "aws",
    "bedrock",
    "diagnostics",
    "repair"
  ],
  "kirocrew": {
    "version": ">=0.7.0 <0.11.0",
    "editions": [
      "internal",
      "external"
    ],
    "strict": false
  },
  "dependsOn": {
    "floofycrew": "^1.0"
  },
  "network": {
    "hosts": [],
    "credentials": false
  },
  "parts": [
    {
      "kind": "python-hook",
      "side": "gateway",
      "path": "hook/",
      "module": "hook",
      "early": false
    },
    {
      "kind": "ui",
      "side": "spa",
      "path": "ui/",
      "entry": "ui/page.mjs",
      "title": "Agent Backend Doctor",
      "icon": "ui/icon.svg"
    }
  ],
  "files": [
    {
      "path": "LICENSE",
      "sha256": "efbb38757df87b37a0ba908725830a90cded07b9842ce24e1635bb0763fa2a34"
    },
    {
      "path": "README.md",
      "sha256": "3d8919de8f221d0333a979649a43840fe97f89e4052c7d5e1af7c8a962786be4"
    },
    {
      "path": "hook/__init__.py",
      "sha256": "e92459a962795eb68712f92779d452d5f1141f1e1bde3b596430cbc67257f363"
    },
    {
      "path": "hook/awsenv.py",
      "sha256": "93b247d4fd371554dd0790d72a03a182e7c4275d710891434c33728366a775df"
    },
    {
      "path": "hook/discovery.py",
      "sha256": "de1c69f9765b7f2ee4bdc26713101f013e47286f6d16da6ccbd3cdff0527f86d"
    },
    {
      "path": "tests/awsenv_test.py",
      "sha256": "0ed0b5786865f67cc9bd7ce8bdd8122d17dee6804a8ecbba1cd1b63b0494a2d5"
    },
    {
      "path": "tests/discovery_test.py",
      "sha256": "a504584497ffbf4f002c828b7bf97111ac34b185ea84a2beb22c6f4a29b65c9e"
    },
    {
      "path": "tests/hook_test.py",
      "sha256": "d2052f8fbc3072264659581bef0b5f552c0ec3e3d853a322f7e24beb19bc0d57"
    },
    {
      "path": "tests/page_probe.py",
      "sha256": "6b25320882cf062238f88aaaa1138798f647782a5db8fb9ddcf97670d283b509"
    },
    {
      "path": "tests/smoke_test.py",
      "sha256": "eccf9033ac6c83a15ebf043adfe4f48ec0b43743409d6b221a113f4938e10741"
    },
    {
      "path": "ui/icon.svg",
      "sha256": "6337600715e085782c058673265388b417056f3fd56ae417d0440b1397c1bd38"
    },
    {
      "path": "ui/page.mjs",
      "sha256": "02af20af8df9fa74897f5dee6e9fc6e0e31986d11451e92ad74aafb09b639fff"
    }
  ]
}
